{
  "schema_version": 1,
  "gate": "candidate_device_matrix",
  "result": "UNKNOWN",
  "target_commit": "aaaaaaaaaaaaaaaaaaaaaaaaaaaaaaaaaaaaaaaa",
  "completed_at": "2026-10-25T12:00:00+11:00",
  "evidence": [
    {
      "path": "example/notes/device-matrix-not-run.txt",
      "sha256": "dddddddddddddddddddddddddddddddddddddddddddddddddddddddddddddddd"
    }
  ],
  "notes": "FIXTURE ONLY — UNKNOWN must not assemble"
}
